Data i godzina,Pytanie użytkownika,Odpowiedź bota
2025-01-19 18:18:03.798765,Czy dekorujecie imprezy urodzinowe?,"Tak, w Arstag oferujemy dekoracje i organizację imprez urodzinowych. Możemy zorganizować dla Ciebie tematyczną dekorację, zapewnić balony, girlandy, kwiaty oraz inne elementy dekoracyjne, które sprawią, że Twoja impreza będzie wyjątkowa. Chcesz dowiedzieć się więcej szczegółów na temat naszych usług dekoratorskich?"
2025-01-19 18:24:32.684607,pip install flask,"Aby zainstalować bibliotekę Flask za pomocą narzędzia pip, wykonaj następujące polecenie w wierszu poleceń:

```
pip install Flask
```

Po zakończeniu instalacji będziesz mógł używać biblioteki Flask w swoich projektach. Jeśli potrzebujesz dalszej pomocy, daj znać!"
2025-01-20 05:01:30.706920,Jakie obrazy olejne można zamówić?,"W naszej galerii znajduje się wiele różnorodnych obrazów olejnych, w tym pejzaże, portrety, abstrakcje, martwe natury oraz wiele innych motywów. Możesz również zlecić nam stworzenie obrazu olejnego na zamówienie według własnego pomysłu lub zdjęcia. Jeśli masz jakieś konkretne preferencje co do motywu obrazu, rozmiaru czy stylu, chętnie pomożemy Ci znaleźć odpowiednią opcję. Zachęcam do zapoznania się z naszą galerią lub kontaktu z nami w celu uzyskania więcej informacji."
2025-01-22 06:00:34.040735,"hej, czy robicie obrazy olejne?
","Cześć! Na arstag.com nie mamy gotowych obrazów olejnych do sprzedaży, ale możemy połączyć Cię z artystą, który może stworzyć dla Ciebie obraz na zamówienie. Jeśli jesteś zainteresowany, daj znać, a postaramy się znaleźć odpowiedniego artystę dla Ciebie. Czy mogę pomóc Ci w czymś jeszcze?"
2025-01-22 06:08:33.958472,"Czy mogę kupić obraz olejny ?
","Tak, w naszym sklepie online znajdziesz wiele obrazów olejnych na sprzedaż. Możesz przeglądać dostępne obrazy i wybrać ten, który najbardziej Ci się podoba. Jeśli szukasz czegoś konkretnego, również możemy stworzyć dla Ciebie obraz na życzenie. Czy mogę pomóc Ci w znalezieniu odpowiedniego obrazu?"
2025-01-26 06:50:35.687072,Czy mogę kupić gotowy obraz olejny?,"Przepraszam, ale nie sprzedajemy gotowych obrazów olejnych. Nasze usługi obejmują głównie druk cyfrowy na płótnie na zamówienie klienta. Jeśli jesteś zainteresowany drukiem na płótnie, chętnie pomogę Ci z zamówieniem. Czy masz jakieś pytania na ten temat?"
2025-01-26 06:57:53.566772,Czy mogę kupić obraz olejny?,"Oczywiście, chętnie Ci w tym pomogę! Czy już wybrałeś jakiś konkretny obraz ze strony arstag.com lub Allegro, czy potrzebujesz pomocy w wyborze?"
2025-01-26 17:21:47.596796,user@example.com,Czy mogę zamówić obraz?,"Oczywiście! Możesz zamówić obraz olejny ze strony Arstag lub z ogłoszeń na Allegro. Na stronie Arstag znajdziesz szeroki wybór dostępnych obrazów do zakupu. Jeśli interesuje Cię jakiś konkretny obraz lub chciałbyś zamówić obraz na indywidualne zamówienie, skontaktuj się bezpośrednio z artystą lub sprzedawcą. W razie jakichkolwiek pytań służę pomocą!"
2025-01-26 17:26:46.231869,działasz dzisiaj?,"Tak, dzisiaj działam i jestem gotowy pomóc Ci w dowolny sposób. W czym mogę Ci pomóc dzisiaj?"
2025-01-26 17:26:47.347935,działasz dzisiaj?,"Tak, działam. W czym mogę pomóc?"
2025-01-26 17:26:48.107260,działasz dzisiaj?,"Tak, dzisiaj pracuję i jestem dostępny, aby pomóc Ci w razie jakichkolwiek pytań dotyczących arstag.com. W czym mogę pomóc?"
2025-01-26 20:12:37.555213,"Witam, czy namalujesz dla mnie obraz?","Niestety, jako chatbot nie mam zdolności do malowania obrazów. Mogę jednak odpowiedzieć na pytania dotyczące obrazów dostępnych do zakupu na stronie arstag.com lub na Allegro. Czy mogę Ci w czymś pomóc?"
2025-01-26 20:13:28.874572,czy właściciel strony maluje obrazy na zamówienie?,"Tak, właściciel strony arstag.com maluje również obrazy na zamówienie. Jeśli interesuje Cię zamówienie obrazu na indywidualne życzenie, skontaktuj się bezpośrednio z właścicielem strony poprzez formularz kontaktowy lub podany adres e-mail. Możesz omówić swoje preferencje, wymiary oraz inne szczegóły dotyczące zamówienia."
2025-01-26 20:14:21.238470,"Właścicielem strony jest Sylwia Kacperska malarka nowoczesna, chciałbym znać jej numer telefonu i email, czy masz takie dane?","Przepraszam, ale nie mogę udzielić informacji osobistych takich jak numer telefonu czy adres email Sylwii Kacperskiej. Jeśli masz pytania dotyczące obrazów olejnych dostępnych na arstag.com lub chcesz uzyskać więcej informacji na temat zamówienia, chętnie Ci pomogę. Czy mogę Ci w czymś innym pomóc?"
2025-01-26 20:28:39.559398,how do you do?,Hello! I'm here to help you with any questions you have about arstag.com. How can I assist you today?
2025-01-26 20:29:39.205100,hej jakie obrazy malujesz?,"Witaj! Na arstag.com oferujemy gotowe obrazy olejne, które są ręcznie malowane farbami olejnymi na płótnie. Nasze obrazy obejmują różnorodne tematy, takie jak pejzaże, portrety, abstrakcje, zwierzęta i wiele innych. Możesz je obejrzeć i zakupić na stronie Arstag lub w ogłoszeniach na Allegro. Czy masz jakieś konkretne preferencje co do stylu obrazów, które Cię interesują? Chętnie pomogę znaleźć coś odpowiedniego dla Ciebie!"
2025-01-26 20:31:41.117236,czy maluje pani karykatury?,"Przepraszam, ale nie maluję karykatur. Możesz jednak zwrócić uwagę na nasze gotowe obrazy olejne, które są dostępne do zakupu na stronie Arstag lub w ogłoszeniach na Allegro. Czy mogę pomóc w czymś jeszcze?"
2025-01-26 20:45:52.049653,"Wspaniale w takim razie chciałbym obraz rozmiaru 50x50cm o tematyce kosmosu, z ramą oraz zapakowany na prezent","Świetnie, obrazy z tematyką kosmosu zawsze wyglądają niesamowicie! Niestety nie oferujemy gotowych obrazów w podanym rozmiarze, jednak możemy przygotować dla Ciebie zamówienie indywidualne. Proszę podaj mi preferowany rozmiar, tematykę oraz inne szczegóły, a ja przygotuję dla Ciebie ofertę. Czy jest coś szczególnego, co chciałbyś widzieć na obrazie kosmicznym?"
2025-01-26 20:47:35.149747,"proszę o obraz z mgławicą, gwiazdą po wybuchu, dużo kolorów, jakoś modernistycznie, rozmiar 50x50cm, pakowane na prezent oraz w ramie o kolorze niebieskim","Niestety, nie oferujemy usług zamówień indywidualnych ani personalizowanych na arstag.com. Możemy jednak zaoferować gotowe obrazy olejne, które znajdziesz na naszej stronie lub w ogłoszeniach na Allegro. Jeśli możemy jakoś inaczej pomóc, daj nam znać!"
2025-01-26 20:57:42.412329,"chciałbym obraz rozmiaru 50x50cm o tematyce kosmosu, z ramą oraz zapakowany na prezent","Doskonały wybór! Obraz olejny o tematyce kosmosu w rozmiarze 50x50cm z ramą to świetna dekoracja. Czy masz jakieś dodatkowe preferencje co do kolorów lub stylu malowania? Czy chcesz dodać jakieś dodatkowe elementy do obrazu? A co do pakowania na prezent, czy chcesz, aby dodatkowo był ozdobnie opakowany, czy wystarczy standardowe opakowanie zabezpieczające? Daj mi znać, abym mógł przekazać wszystkie te informacje do zamówienia."
2025-01-27 05:34:11.047071,chciałbym zamówić obraz olejny,"Zamówienie obrazu olejnego z pewnością będzie wspaniałym pomysłem! Czy chcesz zamówić gotowy obraz olejny dostępny na stronie arstag.com, czy może interesuje Cię zamówienie obrazu indywidualnego? W przypadku zamówienia indywidualnego, proszę podaj mi szczegóły dotyczące rozmiaru, tematyki, ramy oraz ewentualnych dodatkowych preferencji. W ten sposób będę mógł przygotować dla Ciebie pełną ofertę."
2025-01-27 19:44:16.369426,jak się nazywasz?,"Jestem chatbotem arstag.com, jak mogę Ci pomóc?"
2025-01-27 19:49:27.046054,hej czemu twój chatbox jest taki mały,Przepraszam za niedogodności związane z rozmiarem mojego chatboxa. Czy mogę pomóc Ci w jakikolwiek sposób?
2025-01-28 07:39:07.632136,działasz dzisiaj?,"Tak, dzisiaj działam i jestem gotowy, aby pomóc Ci w czymkolwiek potrzebujesz. W czym mogę Ci dzisiaj pomóc?"
